{
  "regions": [
    {
      "region": "us-corn-belt",
      "surveys": [
        { "source": "wssa-2020-survey", "year": 2020, "list": "most-common", "respondents": "317 weed scientists and affiliates, US and Canada (expert opinion, not field counts)", "ranked": ["chenopodium-album", "setaria-faberi", "amaranthus-tuberculatus", "amaranthus-retroflexus", "amaranthus-palmeri", "ipomoea-spp"] },
        { "source": "wssa-2020-survey", "year": 2020, "list": "most-troublesome", "respondents": "317; ranks 4 to 7 from a vendor reading of the same survey", "ranked": ["amaranthus-palmeri", "amaranthus-tuberculatus", "ipomoea-spp", "ambrosia-trifida", "chenopodium-album", "sorghum-halepense", "bassia-scoparia"] }
      ],
      "associations": [
        { "speciesId": "chenopodium-album", "prevalence": "dominant", "surveyRanks": [{ "source": "wssa-2020-survey", "list": "most-common", "rank": 1, "year": 2020 }], "emergence": { "relativeToCrop": "with the crop; peaks late April to mid June by latitude, somewhat protracted", "cropStages": ["VE", "V5"], "months": [4, 5, 6], "evidence": { "sources": ["frontiers-2022-emergence"], "strength": "moderate", "notes": "Stage window is our reading of the emergence dates against a late-April planting." } }, "habitAtPriorityStages": "erect, small at V2; pale mealy leaves", "lookAlikeWithCrop": "low", "resolvableCues": [{ "cue": "pale grey-green tone (never measured from the air)", "minGsdCm": 1, "evidence": { "sources": ["wisc-weed-guide"], "strength": "weak" } }], "evidence": { "sources": ["wssa-2020-survey", "frontiers-2022-emergence"], "strength": "strong" } },
        { "speciesId": "setaria-faberi", "prevalence": "dominant", "surveyRanks": [{ "source": "wssa-2020-survey", "list": "most-common", "rank": 2, "year": 2020 }], "emergence": { "relativeToCrop": "2 to 4 weeks after giant ragweed; one short, prominent peak with the crop", "cropStages": ["VE", "V5"], "months": [5, 6], "evidence": { "sources": ["isu-giant-ragweed-emergence", "frontiers-2022-emergence"], "strength": "moderate" } }, "habitAtPriorityStages": "dense cohorts of small grass seedlings between rows", "lookAlikeWithCrop": "high", "resolvableCues": [{ "cue": "off-row position only; a tuft of many small plants reads as alley cover", "minGsdCm": 3, "evidence": { "sources": ["pena-2013"], "strength": "strong" } }], "evidence": { "sources": ["wssa-2020-survey", "missouri-ipm1024"], "strength": "strong" } },
        { "speciesId": "amaranthus-tuberculatus", "prevalence": "dominant", "surveyRanks": [{ "source": "wssa-2020-survey", "list": "most-common", "rank": 3, "year": 2020 }, { "source": "wssa-2020-survey", "list": "most-troublesome", "rank": 2, "year": 2020 }], "emergence": { "relativeToCrop": "late and prolonged: first at about 425 GDD (base 48 °F), peak 500 to 600; continues all season", "cropStages": ["V3", "V12"], "months": [5, 6, 7, 8], "evidence": { "sources": ["purdue-2023-emergence", "gwc13-waterhemp"], "strength": "moderate" } }, "habitAtPriorityStages": "absent or just emerging at V2, present by V5; erect, glossy, grows about 2.5 cm a day", "lookAlikeWithCrop": "low", "resolvableCues": [{ "cue": "glossy erect object once over 4 px; not separable from Palmer amaranth or redroot pigweed", "minGsdCm": 2, "evidence": { "sources": ["gwc13-waterhemp"], "strength": "weak" } }], "resistanceNotes": "Eight herbicide groups documented; nearly all populations ALS-resistant.", "evidence": { "sources": ["wssa-2020-survey", "gwc13-waterhemp"], "strength": "strong" } },
        { "speciesId": "amaranthus-palmeri", "prevalence": "common", "surveyRanks": [{ "source": "wssa-2020-survey", "list": "most-troublesome", "rank": 1, "year": 2020 }], "emergence": { "relativeToCrop": "prolonged, May to September in Texas", "cropStages": ["V2", "R1"], "months": [5, 6, 7, 8, 9], "evidence": { "sources": ["keeling-2015"], "strength": "moderate" } }, "lookAlikeWithCrop": "low", "resistanceNotes": "Resistance across groups 2, 3, 4, 5, 9, 10, 14, 15 and 27 in Arkansas.", "evidence": { "sources": ["wssa-2020-survey", "keeling-2015"], "strength": "moderate" } },
        { "speciesId": "ambrosia-trifida", "prevalence": "common", "surveyRanks": [{ "source": "wssa-2020-survey", "list": "most-troublesome", "rank": 4, "year": 2020 }], "emergence": { "relativeToCrop": "earliest: from March to early April, about 120 GDD (base 48 °F), peak 200 to 300; Iowa biotypes 90% in under 20 days, Ohio and Illinois biotypes prolonged", "cropStages": ["VE", "V4"], "months": [3, 4, 5], "evidence": { "sources": ["isu-giant-ragweed-emergence", "purdue-2023-emergence", "take-action-giant-ragweed-2025"], "strength": "moderate" } }, "habitAtPriorityStages": "erect, opposite 3 to 5 lobed leaves 10 to 20 cm wide; quickly grows above the crop", "lookAlikeWithCrop": "low", "resolvableCues": [{ "cue": "the one broadleaf reliably an object by V4 at 1 to 3 cm; the only thing over the canopy late", "minGsdCm": 3, "evidence": { "sources": ["gwc12-giant-ragweed"], "strength": "moderate" } }], "escapesAboveCanopy": true, "resistanceNotes": "ALS since 1996; glyphosate resistance in 12 states.", "evidence": { "sources": ["gwc12-giant-ragweed", "take-action-giant-ragweed-2025"], "strength": "strong" } },
        { "speciesId": "abutilon-theophrasti", "prevalence": "common", "emergence": { "relativeToCrop": "about one week after giant ragweed (Iowa, 1998)", "cropStages": ["VE", "V4"], "evidence": { "sources": ["wisc-weed-guide"], "strength": "snippet" } }, "habitAtPriorityStages": "erect; very large heart-shaped hairy leaves", "lookAlikeWithCrop": "low", "resolvableCues": [{ "cue": "round pale blob with a smooth outline by about the 4-leaf stage", "minGsdCm": 2, "evidence": { "sources": ["wisc-weed-guide"], "strength": "weak" } }], "evidence": { "sources": ["wisc-weed-guide", "johnson-1996"], "strength": "moderate" } },
        { "speciesId": "ambrosia-artemisiifolia", "prevalence": "common", "emergence": { "relativeToCrop": "early, curtails sharply in June", "cropStages": ["VE", "V4"], "months": [4, 5], "evidence": { "sources": ["frontiers-2022-emergence"], "strength": "moderate" } }, "lookAlikeWithCrop": "low", "evidence": { "sources": ["clay-2006", "frontiers-2022-emergence"], "strength": "moderate" } },
        { "speciesId": "sorghum-halepense", "prevalence": "regional", "surveyRanks": [{ "source": "wssa-2020-survey", "list": "most-troublesome", "rank": 6, "year": 2020 }], "emergence": { "relativeToCrop": "rhizome shoots early and in the same patch every year; seedlings with the crop", "cropStages": ["VE", "V6"], "evidence": { "sources": ["missouri-ipm1024"], "strength": "weak" } }, "habitAtPriorityStages": "dense colonies; corn-sized leaves; outgrows seedling corn", "lookAlikeWithCrop": "high", "escapesAboveCanopy": true, "evidence": { "sources": ["missouri-ipm1024", "va-pmg-2021"], "strength": "moderate" } },
        { "speciesId": "zea-mays-volunteer", "prevalence": "regional", "emergence": { "relativeToCrop": "with the crop, from dropped ears, after corn-on-corn", "cropStages": ["VE", "V3"], "evidence": { "sources": ["va-pmg-2021"], "strength": "weak" } }, "lookAlikeWithCrop": "high", "evidence": { "sources": ["va-pmg-2021"], "strength": "weak" } },
        { "speciesId": "bassia-scoparia", "prevalence": "regional", "surveyRanks": [{ "source": "wssa-2020-survey", "list": "most-troublesome", "rank": 7, "year": 2020 }], "emergence": { "relativeToCrop": "early (timing not retrieved)", "evidence": { "sources": [], "strength": "none" } }, "lookAlikeWithCrop": "low", "evidence": { "sources": ["corteva-worst-weeds"], "strength": "snippet" } }
      ]
    },
    {
      "region": "us-mid-atlantic",
      "surveys": [],
      "associations": [
        { "speciesId": "amaranthus-palmeri", "prevalence": "common", "emergence": { "relativeToCrop": "prolonged through the season", "cropStages": ["V2", "R1"], "evidence": { "sources": ["va-pmg-2021"], "strength": "weak" } }, "lookAlikeWithCrop": "low", "resistanceNotes": "Assume groups 2 and 9 resistance in Virginia Palmer amaranth when unknown (snippet).", "evidence": { "sources": ["va-pmg-2021"], "strength": "moderate" } },
        { "speciesId": "amaranthus-tuberculatus", "prevalence": "common", "emergence": { "relativeToCrop": "late and prolonged", "cropStages": ["V3", "V12"], "evidence": { "sources": ["gwc13-waterhemp"], "strength": "moderate" } }, "lookAlikeWithCrop": "low", "evidence": { "sources": ["va-pmg-2021"], "strength": "moderate" } },
        { "speciesId": "chenopodium-album", "prevalence": "common", "emergence": { "relativeToCrop": "Mid-Atlantic 11 May to 1 June", "cropStages": ["VE", "V5"], "months": [5, 6], "evidence": { "sources": ["frontiers-2022-emergence"], "strength": "moderate" } }, "lookAlikeWithCrop": "low", "evidence": { "sources": ["va-pmg-2021"], "strength": "moderate" } },
        { "speciesId": "setaria-faberi", "prevalence": "common", "emergence": { "relativeToCrop": "Mid-Atlantic peak 2 to 24 May", "cropStages": ["VE", "V5"], "months": [5], "evidence": { "sources": ["frontiers-2022-emergence"], "strength": "moderate" } }, "lookAlikeWithCrop": "high", "evidence": { "sources": ["va-pmg-2021"], "strength": "moderate" } },
        { "speciesId": "digitaria-sanguinalis", "prevalence": "common", "emergence": { "relativeToCrop": "Mid-Atlantic 18 May to 8 June", "cropStages": ["V1", "V6"], "months": [5, 6], "evidence": { "sources": ["frontiers-2022-emergence"], "strength": "moderate" } }, "lookAlikeWithCrop": "medium", "evidence": { "sources": ["va-pmg-2021"], "strength": "moderate" } },
        { "speciesId": "ambrosia-artemisiifolia", "prevalence": "common", "emergence": { "relativeToCrop": "Mid-Atlantic peak 7 April to 1 May", "cropStages": ["VE", "V3"], "months": [4, 5], "evidence": { "sources": ["frontiers-2022-emergence"], "strength": "moderate" } }, "lookAlikeWithCrop": "low", "evidence": { "sources": ["va-pmg-2021"], "strength": "moderate" } },